{
  "$format": "kickstartds/component-narrative@1",
  "component": "Blog Head",
  "default": {
    "description": "The component features a clean and simple design with a prominent headline in bold, dark text at the top, providing a clear focal point. Below the headline, there is a small image with an alt text description, adding a visual element to the layout. The overall appearance is minimalistic, with a light background that enhances readability and a subtle border that frames the content.",
    "from": "img/screenshots/contract-defaults-bloghead--contract-default.png"
  },
  "variants": [
    {
      "story": "blog-blog-head--default",
      "when": {},
      "difference": "In this variant, the component is significantly larger, with the image expanding to fill most of the space, creating a more immersive visual experience. The addition of a date and extra metadata above the headline provides context and categorization, enhancing the informational aspect of the design. The overall layout feels more dynamic and content-rich compared to the minimalistic default.",
      "from": "img/screenshots/blog-blog-head--default.png"
    }
  ],
  "generated": {
    "model": "gpt-4o-2024-08-06",
    "promptVersion": 1,
    "generatedAt": "2026-09-26T20:43:47.637Z",
    "inputs": {
      "screenshots": {
        "img/screenshots/contract-defaults-bloghead--contract-default.png": "sha256:7a3c9fe89733a435",
        "img/screenshots/blog-blog-head--default.png": "sha256:b3afacdfaecf1084"
      },
      "contract": "sha256:c4e87b7f27d1ca144c4b336a87ca94fac6fb335df23d57341f0cebd0f50d11d1"
    }
  }
}
