{
  "$format": "kickstartds/component-narrative@1",
  "component": "Html",
  "default": {
    "description": "The component appears as a clean, white rectangular box with a subtle shadow, giving it a slightly elevated look against a light gray background. The aspect ratio is sixteen-to-nine, creating a balanced and modern appearance. The rounded corners add a touch of softness to the overall design.",
    "from": "img/screenshots/contract-defaults-html--contract-default.png"
  },
  "variants": [
    {
      "story": "components-html--html",
      "when": {},
      "difference": "In this variant, the component includes the text \"Hello World\" inside the box, which was not present in the default. The text is positioned towards the left, adding a simple yet noticeable element to the otherwise clean design.",
      "from": "img/screenshots/components-html--html.png"
    },
    {
      "story": "components-html--with-consent",
      "when": {
        "consent": true
      },
      "difference": "In this variant, the component introduces a consent feature, overlaying the original design with a semi-transparent background image. A prompt appears in the center, asking for user consent, accompanied by a prominent button labeled \"yes!\" The overall look is more interactive and visually engaging compared to the default.",
      "from": "img/screenshots/components-html--with-consent.png"
    },
    {
      "story": "components-html--with-script",
      "when": {
        "consent": true
      },
      "difference": "In this variant, the component no longer displays a background image, resulting in a simpler appearance. The button within the component is noticeably wider, enhancing its prominence and making it more inviting for interaction. The overall design maintains its clean and modern look, with the button providing a focal point.",
      "from": "img/screenshots/components-html--with-script.png"
    }
  ],
  "generated": {
    "model": "gpt-4o-2024-08-06",
    "promptVersion": 1,
    "generatedAt": "2026-09-26T20:46:00.342Z",
    "inputs": {
      "screenshots": {
        "img/screenshots/contract-defaults-html--contract-default.png": "sha256:19e7b924dba4bdec",
        "img/screenshots/components-html--html.png": "sha256:45d51d50e9406795",
        "img/screenshots/components-html--with-consent.png": "sha256:a1c1c6f414daab49",
        "img/screenshots/components-html--with-script.png": "sha256:51e892285ff9c07d"
      },
      "contract": "sha256:7a032eb3afca00afbbdef3d4e69b55e4bae458657c3d2e9dad2e2f1f6763c0e0"
    }
  }
}
